{
  "id": "qwen4",
  "title": "Qwen4 architecture",
  "summary": "A primary observation point for changes in next-generation LLM architecture, especially information flow, recurrent state, reasoning computation, and inference-time adaptation.",
  "status": "WATCH",
  "tags": ["llm", "architecture", "qwen"],
  "currentAssessment": "Worth tracking as a likely integration point for architectural ideas that matter beyond benchmark gains or routine scaling.",
  "reevaluationTriggers": [
    "A materially new architecture is documented in an official release or technical report.",
    "An open-weight implementation makes the architecture practical to inspect or run locally.",
    "A runtime implementation reveals important behavior for Apple Silicon or local inference."
  ]
}
